question,option1,option2,option3,option4,answer,solution
When did the Insolvency and Bankruptcy Code 2016 receive the President�s assent,05-Aug-16,28-May-16,05-May-16,15-Jun-16,2,fsdfsf
What is the applicability of IBC:,"Companies incorporated under the Companies Act, 2013 or under any previous company law, Limited Liability Partnerships incorporated under Limited Liability Partnership Act, 2008, Partnership firms and Individuals.","Companies incorporated under the Companies Act, 2013 or under any previous company law, Hindu Undivided Family, Partnership firms and Individuals.","Companies incorporated under the Companies Act, 2013 or under any previous company law, Limited Liability Partnerships incorporated under Limited Liability Partnership Act, 2008 and Co-operative Societies registered under Co-operative Societies Act, 1972.","Companies incorporated under the Companies Act, 2013 or under any previous company law, Trusts under the Indian Trusts Act, 1882, Co-operative Societies registered under Co-operative Societies Act, 1972, Individuals.",1,fsdfsf
What is the impact of IBC on other legislation?,IBC does not have any effect on other legislations,Other legislations shall have an overriding effect on IBC,IBC has an overriding effect on other legislations.,IBC is an independent code.,3,fsdfsf
Which Legislations are getting repealed on enforcement of IBC,"The Presidency Towns Insolvency Act 1909, Provincial Insolvency Act 1920 and Sick Industrial Companies (Special Provisions) Act 1985.","Sick Industrial Companies (Special Provisions) Act 1985, The Securitisation and Reconstruction of Financial Assets and Enforcement of Security Interest Act 2002 and The Payment and Settlement Systems Act 2007.","Provincial Insolvency Act 1920, The Securitisation and Reconstruction of Financial Assets and Enforcement of Security Interest Act 2002 and Recovery of Debts due to Banks and Financial Institutions Act, 1993.","Sick Industrial Companies (Special Provisions) Act 1985 and some provisions of Negotiable Instruments Act, 1881.",1,fsdfsf
Who can initiate Corporate Insolvency Resolution Process (CIRP),Only Corporate Debtor,Financial Creditor and Operational Creditor.,"Financial Creditor, Operational Creditor and Corporate Debtor",Corporate Debtor and Financial Creditor.,3,fsdfsf
When can CIRP be initiated?,The minimum amount of default is Rupees Five Lakh or such higher amount which shall not exceed Rupees Two Crore,The minimum amount of default is Rupees One Lakh or such higher amount which shall not exceed Rupees One Crore,The minimum amount of default is Rupees Ten Lakh or such higher amount which shall not exceed Rupees Three Crore.,The minimum amount of default is Rupees Eight Lakh or such higher amount which shall not exceed Rupees Three Crore.,2,fsdfsf
What constitutes default under IBC,Non-payment of debt when whole or any part or instalment of the amount of debt has become due and payable and is not repaid by the debtor or the corporate debtor.,Non-payment of debt when whole or part of the payment is demanded by the financial or operational creditor.,"Non-payment of any amount, whether in full or in part, on demand by the creditors or concerned authorities.",Any payment of the creditor that is subsisting,1,fsdfsf
What is debt under IBC?,Any amount of money that is owed or due to any party,A liability or obligation in respect of a claim which is due from any person and includes a financial debt and operational debt,Any liability arising in respect of money advanced by a creditor to the debtor,Debts arising out of loans advanced by a financial institution,2,fsdfsf
